{
  "schemaVersion": "1.0.0",
  "source": "Piaget stages, Montessori practical life, WHO/UNICEF early childhood guidelines. Home activities, not a clinical program.",
  "ageBands": [
    {
      "id": "2-5",
      "ageMinYears": 2,
      "ageMaxYears": 5,
      "label": "Toddlers & preschool",
      "science": "Neuroplasticity peak for language, motor, and sensory maps. Preoperational play plus Montessori practical life.",
      "activityIds": ["story-books", "sort-match", "music-rhythm", "outdoor-play", "art-large-tools"]
    },
    {
      "id": "6-9",
      "ageMinYears": 6,
      "ageMaxYears": 9,
      "label": "Early elementary",
      "science": "Concrete-operational thinking. Executive function grows with rules, sequencing, and shared play.",
      "activityIds": ["science-experiments", "board-strategy", "scratch-jr", "cooking-recipes", "team-sports"]
    },
    {
      "id": "10-13",
      "ageMinYears": 10,
      "ageMaxYears": 13,
      "label": "Upper elementary & pre-teens",
      "science": "Identity and autonomy. Whole-child work: projects, empathy, discipline, and emotional regulation.",
      "activityIds": ["project-based", "foreign-language", "instrument-training", "community-service", "mindfulness-journal"]
    }
  ],
  "bmiOverlays": {
    "infant": {
      "cue": "Under 2: serve-and-return, rhythm, and floor play. Skip BMI cuts.",
      "boostIds": ["story-books", "music-rhythm", "outdoor-play"],
      "minutesAdj": 0
    },
    "under": {
      "cue": "Needs extra energy: keep outdoor play and cooking. This is growth fuel, not a diet.",
      "boostIds": ["outdoor-play", "cooking-recipes", "team-sports", "art-large-tools"],
      "minutesAdj": 5
    },
    "healthy": {
      "cue": "Rotate cognitive, physical, social, and creative — one featured task a day.",
      "boostIds": [],
      "minutesAdj": 0
    },
    "watch": {
      "cue": "Lead with movement and outdoor time. Veg, water, and play — never a restriction plan.",
      "boostIds": ["outdoor-play", "team-sports", "mindfulness-journal", "cooking-recipes"],
      "minutesAdj": 10
    },
    "high": {
      "cue": "More active play and team games. Mindfulness after movement. Nutrient quality, not restriction.",
      "boostIds": ["outdoor-play", "team-sports", "mindfulness-journal"],
      "minutesAdj": 15
    }
  },
  "activities": [
    {
      "id": "story-books",
      "n": 1,
      "name": "Storytelling & picture books",
      "ageBand": "2-5",
      "skillId": "language",
      "domains": ["cognitive", "emotional", "social"],
      "minutes": 12,
      "why": "Builds language, imagination, and empathy (WHO responsive caregiving).",
      "todayTask": "Read one picture book. Pause on two pages and ask “how does the character feel?”",
      "infantTask": "Hold the book, name 5 pictures, and wait for a babble or point.",
      "materials": ["picture book", "lap time"]
    },
    {
      "id": "sort-match",
      "n": 2,
      "name": "Sorting & matching games",
      "ageBand": "2-5",
      "skillId": "numeracy",
      "domains": ["cognitive"],
      "minutes": 10,
      "why": "Early numeracy and pattern recognition (Piaget preoperational; Montessori sensorial).",
      "todayTask": "Sort 8 socks or spoons by colour/size. Let them check the last pair.",
      "infantTask": "Offer two cups: big and small. Name “this one, that one.”",
      "materials": ["socks", "spoons", "blocks"]
    },
    {
      "id": "music-rhythm",
      "n": 3,
      "name": "Music & rhythm play",
      "ageBand": "2-5",
      "skillId": "music",
      "domains": ["cognitive", "creative", "physical"],
      "minutes": 10,
      "why": "Auditory processing and working memory. Rhythm scaffolds language.",
      "todayTask": "Clap a 1-2-1-2 pattern to a song. Freeze when the music stops.",
      "infantTask": "Pat a steady beat on the back during one lullaby.",
      "materials": ["song", "pots or clap"]
    },
    {
      "id": "outdoor-play",
      "n": 4,
      "name": "Outdoor free play",
      "ageBand": "2-5",
      "skillId": "motor",
      "domains": ["physical", "social"],
      "minutes": 20,
      "why": "Gross motor, balance, and vestibular input (WHO 180 min/day movement for 1–4 years, including active play).",
      "todayTask": "Park or terrace: run, climb one safe object, then water. No screens until after.",
      "infantTask": "Outdoor air on a mat. Tummy time facing a moving leaf or cloth.",
      "materials": ["open space", "water bottle"]
    },
    {
      "id": "art-large-tools",
      "n": 5,
      "name": "Art with large tools",
      "ageBand": "2-5",
      "skillId": "fineMotor",
      "domains": ["creative", "physical"],
      "minutes": 12,
      "why": "Fine motor control and hand-eye coordination before pencil grip.",
      "todayTask": "Chunky crayon or chalk rangoli dots on big paper. Name the colours.",
      "infantTask": "Finger-paint yogurt on a tray (taste-safe) for 3 minutes.",
      "materials": ["chunky crayons", "big paper"]
    },
    {
      "id": "science-experiments",
      "n": 6,
      "name": "Hands-on science experiments",
      "ageBand": "6-9",
      "skillId": "science",
      "domains": ["cognitive"],
      "minutes": 15,
      "why": "Cause-effect and hypothesis talk in the concrete-operational years.",
      "todayTask": "Vinegar + baking soda in a cup. Guess first: will it fizz more with warm water?",
      "materials": ["vinegar", "baking soda", "cup"]
    },
    {
      "id": "board-strategy",
      "n": 7,
      "name": "Board games & strategy play",
      "ageBand": "6-9",
      "skillId": "focus",
      "domains": ["cognitive", "social", "emotional"],
      "minutes": 20,
      "why": "Logic, turn-taking, and frustration tolerance — executive function with rules.",
      "todayTask": "One short board or card game. Loser chooses the next song, not a rematch argument.",
      "materials": ["Ludo / Uno / chess beginner"]
    },
    {
      "id": "scratch-jr",
      "n": 8,
      "name": "Coding with visual blocks (Scratch Jr)",
      "ageBand": "6-9",
      "skillId": "numeracy",
      "domains": ["cognitive"],
      "minutes": 15,
      "why": "Computational thinking: sequence, loop, debug — age-fit, not adult syntax.",
      "todayTask": "Make a sprite walk to a fruit and say one word. If it fails, change one block only.",
      "materials": ["Scratch Jr app", "10-minute timer"]
    },
    {
      "id": "cooking-recipes",
      "n": 9,
      "name": "Cooking simple recipes",
      "ageBand": "6-9",
      "skillId": "leadership",
      "domains": ["cognitive", "physical"],
      "minutes": 20,
      "why": "Measuring (math), sequencing, and independence. Ties to the family meal planner.",
      "todayTask": "Help measure 1 cup poha or 2 idlis’ worth of batter. Child plates the fruit.",
      "materials": ["measuring cup", "today’s Willow plate"]
    },
    {
      "id": "team-sports",
      "n": 10,
      "name": "Team sports",
      "ageBand": "6-9",
      "skillId": "motor",
      "domains": ["physical", "social"],
      "minutes": 25,
      "why": "Cooperation, discipline, and cardio health. Social rules under movement.",
      "todayTask": "15 minutes kho-kho, cricket catch, or football pass. Water first. Then praise effort.",
      "materials": ["ball", "open space"]
    },
    {
      "id": "project-based",
      "n": 11,
      "name": "Project-based learning",
      "ageBand": "10-13",
      "skillId": "science",
      "domains": ["cognitive", "creative"],
      "minutes": 25,
      "why": "Autonomy and deep work. Build → explain → revise (identity via competence).",
      "todayTask": "20 minutes on one project: a model, a 5-slide talk, or a mini research note. End with “what I still wonder.”",
      "materials": ["notebook", "recycled materials"]
    },
    {
      "id": "foreign-language",
      "n": 12,
      "name": "Foreign language exposure",
      "ageBand": "10-13",
      "skillId": "language",
      "domains": ["cognitive"],
      "minutes": 15,
      "why": "Cognitive flexibility and memory. Dual-language homes already have a head start.",
      "todayTask": "Learn 5 food words in a second language (or mother tongue script) and use two at dinner.",
      "materials": ["phrase list", "dinner table"]
    },
    {
      "id": "instrument-training",
      "n": 13,
      "name": "Music instrument training",
      "ageBand": "10-13",
      "skillId": "music",
      "domains": ["cognitive", "creative", "emotional"],
      "minutes": 20,
      "why": "Executive function, delayed gratification, and auditory-motor maps.",
      "todayTask": "One scale or one song section. Record 30 seconds. Replay once — no perfection talk.",
      "materials": ["instrument or keyboard app"]
    },
    {
      "id": "community-service",
      "n": 14,
      "name": "Community service activities",
      "ageBand": "10-13",
      "skillId": "leadership",
      "domains": ["social", "emotional"],
      "minutes": 20,
      "why": "Empathy, responsibility, civic identity — not resume padding.",
      "todayTask": "One real help: pack a tiffin for a neighbour, water a plant on the street, or sort recycling.",
      "materials": ["a 20-minute helper job"]
    },
    {
      "id": "mindfulness-journal",
      "n": 15,
      "name": "Mindfulness & journaling",
      "ageBand": "10-13",
      "skillId": "focus",
      "domains": ["emotional", "cognitive"],
      "minutes": 10,
      "why": "Emotional regulation and self-reflection. Pair with movement if the BMI band is watch/high.",
      "todayTask": "3 slow breaths after play, then two sentences: one glad, one hard. No body-shame prompts.",
      "materials": ["notebook", "quiet corner"]
    }
  ]
}
